{
  "$schema": "https://json-schema.org/draft/2020-12/schema",
  "title": "Blogs",
  "type": "array",
  "items": {
    "type": "object",
    "additionalProperties": false,
    "required": ["slug", "title", "excerpt", "date", "category", "content"],
    "properties": {
      "slug": { "type": "string", "minLength": 1 },
      "title": { "type": "string", "minLength": 1 },
      "excerpt": { "type": "string", "minLength": 1 },
      "date": { "type": "string", "minLength": 1 },
      "category": { "type": "string", "minLength": 1 },
      "content": {
        "type": "array",
        "minItems": 1,
        "items": { "type": "string", "minLength": 1 }
      }
    }
  }
}
